{
 "schema_version": "2.1",
 "id": "rm_survey123",
 "slug": "survey123",
 "title": "ArcGIS Survey123 skill roadmap",
 "tool_ids": [
  "tool_survey123"
 ],
 "levels": {
  "beginner": [
   {
    "id": "mod_survey123_field_app_0",
    "slug": "survey123-field-app-0",
    "title": "Get started with ArcGIS Survey123",
    "outcome": "You can: set up ArcGIS Survey123, find your way around and finish a first small task",
    "topics": [
     "installation or account setup",
     "interface tour",
     "settings and accessibility options",
     "saving, exporting and sharing",
     "official help and documentation"
    ],
    "practice": "Complete the official getting-started guide, then one small real task from your work",
    "need_tags": [
     "forms-surveys",
     "monitoring-evaluation",
     "research-surveys"
    ],
    "estimated_hours": {
     "value": 1,
     "is_estimate": true
    },
    "level": "beginner"
   },
   {
    "id": "mod_survey123_field_app_1",
    "slug": "survey123-field-app-1",
    "title": "Set up for your situation",
    "outcome": "You can: configure ArcGIS Survey123 for your farm, site or community",
    "topics": [
     "profile",
     "locations",
     "units",
     "offline settings"
    ],
    "practice": "Set up your locations and units",
    "need_tags": [
     "forms-surveys",
     "monitoring-evaluation",
     "research-surveys"
    ],
    "estimated_hours": {
     "value": 0.5,
     "is_estimate": true
    },
    "level": "beginner"
   },
   {
    "id": "mod_survey123_field_app_2",
    "slug": "survey123-field-app-2",
    "title": "Record in the field",
    "outcome": "You can: record quickly and accurately",
    "topics": [
     "photos",
     "GPS",
     "observations",
     "offline use"
    ],
    "practice": "Record five observations in the field",
    "need_tags": [
     "forms-surveys",
     "monitoring-evaluation",
     "research-surveys"
    ],
    "estimated_hours": {
     "value": 0.5,
     "is_estimate": true
    },
    "level": "beginner"
   }
  ],
  "intermediate": [
   {
    "id": "mod_survey123_field_app_3",
    "slug": "survey123-field-app-3",
    "title": "Use the insights",
    "outcome": "You can: turn records into decisions",
    "topics": [
     "reports",
     "alerts",
     "recommendations"
    ],
    "practice": "Act on one insight from ArcGIS Survey123",
    "need_tags": [
     "forms-surveys",
     "monitoring-evaluation",
     "research-surveys"
    ],
    "estimated_hours": {
     "value": 1.0,
     "is_estimate": true
    },
    "level": "intermediate"
   },
   {
    "id": "mod_survey123_field_app_4",
    "slug": "survey123-field-app-4",
    "title": "Share and collaborate",
    "outcome": "You can: share data with your team or advisers",
    "topics": [
     "sharing",
     "exports",
     "permissions"
    ],
    "practice": "Share a report with an adviser or buyer",
    "need_tags": [
     "forms-surveys",
     "monitoring-evaluation",
     "research-surveys"
    ],
    "estimated_hours": {
     "value": 0.5,
     "is_estimate": true
    },
    "level": "intermediate"
   },
   {
    "id": "mod_survey123_field_app_8",
    "slug": "survey123-field-app-8",
    "title": "Signature skills in ArcGIS Survey123",
    "outcome": "You can: use the features that make ArcGIS Survey123 distinctive",
    "topics": [
     "setup",
     "recording in the field",
     "syncing"
    ],
    "practice": "Use each of these features once on a real piece of work",
    "need_tags": [
     "forms-surveys",
     "monitoring-evaluation",
     "research-surveys"
    ],
    "estimated_hours": {
     "value": 3,
     "is_estimate": true
    },
    "level": "intermediate"
   }
  ],
  "expert": [
   {
    "id": "mod_survey123_field_app_9",
    "slug": "survey123-field-app-9",
    "title": "Advanced ArcGIS Survey123",
    "outcome": "You can: use ArcGIS Survey123's advanced capabilities with confidence",
    "topics": [
     "reports",
     "sharing with partners",
     "data quality"
    ],
    "practice": "Complete a project that needs at least two of these advanced capabilities",
    "need_tags": [
     "forms-surveys",
     "monitoring-evaluation",
     "research-surveys"
    ],
    "estimated_hours": {
     "value": 4,
     "is_estimate": true
    },
    "level": "expert"
   },
   {
    "id": "mod_survey123_field_app_5",
    "slug": "survey123-field-app-5",
    "title": "Data you can trust",
    "outcome": "You can: keep good records over seasons",
    "topics": [
     "consistency",
     "backups",
     "comparing seasons"
    ],
    "practice": "Compare this season with last",
    "need_tags": [
     "farm-records",
     "forms-surveys",
     "monitoring-evaluation",
     "research-surveys"
    ],
    "estimated_hours": {
     "value": 1.5,
     "is_estimate": true
    },
    "level": "expert"
   },
   {
    "id": "mod_survey123_field_app_10",
    "slug": "survey123-field-app-10",
    "title": "Integrate ArcGIS Survey123 into your workflow",
    "outcome": "You can: connect ArcGIS Survey123 with the other tools you use",
    "topics": [
     "imports and exports",
     "file formats",
     "integrations or APIs where available",
     "automation of repeated steps"
    ],
    "practice": "Connect ArcGIS Survey123 to one other tool you use and remove one manual step",
    "need_tags": [
     "automation-workflows",
     "forms-surveys",
     "monitoring-evaluation",
     "research-surveys"
    ],
    "estimated_hours": {
     "value": 2,
     "is_estimate": true
    },
    "level": "expert"
   },
   {
    "id": "mod_survey123_field_app_11",
    "slug": "survey123-field-app-11",
    "title": "Lead and teach others",
    "outcome": "You can: set standards and teach others to use ArcGIS Survey123 well",
    "topics": [
     "templates and conventions",
     "quality checks",
     "privacy and security settings",
     "onboarding a colleague or friend"
    ],
    "practice": "Write a one-page \"how we use ArcGIS Survey123\" guide and teach it to one person",
    "need_tags": [
     "workshop-facilitation",
     "forms-surveys",
     "monitoring-evaluation",
     "research-surveys"
    ],
    "estimated_hours": {
     "value": 2,
     "is_estimate": true
    },
    "level": "expert"
   }
  ]
 },
 "authoring": "archetype",
 "archetype": "field-app",
 "expert_validation": {
  "status": "pending",
  "note": "Generated from the archetype template plus tool-specific signature skills; to be reviewed by a practitioner."
 },
 "is_illustrative": false
}