{
 "schema_version": "2.1",
 "id": "rm_graylog",
 "slug": "graylog",
 "title": "Graylog skill roadmap",
 "tool_ids": [
  "tool_graylog"
 ],
 "levels": {
  "beginner": [
   {
    "id": "mod_graylog_security_tool_0",
    "slug": "graylog-security-tool-0",
    "title": "Get started with Graylog",
    "outcome": "You can: set up Graylog, find your way around and finish a first small task",
    "topics": [
     "installation or account setup",
     "interface tour",
     "settings and accessibility options",
     "saving, exporting and sharing",
     "official help and documentation"
    ],
    "practice": "Complete the official getting-started guide, then one small real task from your work",
    "need_tags": [
     "security-operations",
     "digital-forensics"
    ],
    "estimated_hours": {
     "value": 1,
     "is_estimate": true
    },
    "level": "beginner"
   },
   {
    "id": "mod_graylog_security_tool_1",
    "slug": "graylog-security-tool-1",
    "title": "Lab and legal basics",
    "outcome": "You can: use Graylog safely and legally",
    "topics": [
     "authorisation",
     "scope",
     "lab setup",
     "ethics"
    ],
    "practice": "Set up a practice lab and write a scope statement",
    "need_tags": [
     "security-testing",
     "security-operations",
     "digital-forensics"
    ],
    "estimated_hours": {
     "value": 2.0,
     "is_estimate": true
    },
    "level": "beginner"
   },
   {
    "id": "mod_graylog_security_tool_2",
    "slug": "graylog-security-tool-2",
    "title": "Core use",
    "outcome": "You can: perform the main task of Graylog in a lab",
    "topics": [
     "core features",
     "reading output",
     "common options"
    ],
    "practice": "Complete a guided lab exercise",
    "need_tags": [
     "security-testing",
     "security-operations",
     "digital-forensics"
    ],
    "estimated_hours": {
     "value": 3.0,
     "is_estimate": true
    },
    "level": "beginner"
   }
  ],
  "intermediate": [
   {
    "id": "mod_graylog_security_tool_3",
    "slug": "graylog-security-tool-3",
    "title": "Analyse findings",
    "outcome": "You can: interpret results and reduce false positives",
    "topics": [
     "triage",
     "severity",
     "evidence",
     "false positives"
    ],
    "practice": "Triage findings from a lab run",
    "need_tags": [
     "security-operations",
     "digital-forensics"
    ],
    "estimated_hours": {
     "value": 3.0,
     "is_estimate": true
    },
    "level": "intermediate"
   },
   {
    "id": "mod_graylog_security_tool_4",
    "slug": "graylog-security-tool-4",
    "title": "Report clearly",
    "outcome": "You can: write reports people act on",
    "topics": [
     "findings",
     "evidence",
     "remediation",
     "executive summary"
    ],
    "practice": "Write a short findings report",
    "need_tags": [
     "technical-writing",
     "security-operations",
     "digital-forensics"
    ],
    "estimated_hours": {
     "value": 2.0,
     "is_estimate": true
    },
    "level": "intermediate"
   },
   {
    "id": "mod_graylog_security_tool_8",
    "slug": "graylog-security-tool-8",
    "title": "Signature skills in Graylog",
    "outcome": "You can: use the features that make Graylog distinctive",
    "topics": [
     "setup in a lab",
     "core scans/analysis",
     "reporting"
    ],
    "practice": "Use each of these features once on a real piece of work",
    "need_tags": [
     "security-operations",
     "digital-forensics"
    ],
    "estimated_hours": {
     "value": 3,
     "is_estimate": true
    },
    "level": "intermediate"
   }
  ],
  "expert": [
   {
    "id": "mod_graylog_security_tool_9",
    "slug": "graylog-security-tool-9",
    "title": "Advanced Graylog",
    "outcome": "You can: use Graylog's advanced capabilities with confidence",
    "topics": [
     "advanced techniques",
     "automation",
     "legal and ethical rules"
    ],
    "practice": "Complete a project that needs at least two of these advanced capabilities",
    "need_tags": [
     "security-operations",
     "digital-forensics"
    ],
    "estimated_hours": {
     "value": 4,
     "is_estimate": true
    },
    "level": "expert"
   },
   {
    "id": "mod_graylog_security_tool_5",
    "slug": "graylog-security-tool-5",
    "title": "Automate and integrate",
    "outcome": "You can: use Graylog in a mature security programme",
    "topics": [
     "automation",
     "detection rules",
     "chain of custody",
     "continuous monitoring"
    ],
    "practice": "Automate one recurring check",
    "need_tags": [
     "security-operations",
     "digital-forensics"
    ],
    "estimated_hours": {
     "value": 4.0,
     "is_estimate": true
    },
    "level": "expert"
   },
   {
    "id": "mod_graylog_security_tool_10",
    "slug": "graylog-security-tool-10",
    "title": "Integrate Graylog into your workflow",
    "outcome": "You can: connect Graylog with the other tools you use",
    "topics": [
     "imports and exports",
     "file formats",
     "integrations or APIs where available",
     "automation of repeated steps"
    ],
    "practice": "Connect Graylog to one other tool you use and remove one manual step",
    "need_tags": [
     "automation-workflows",
     "security-operations",
     "digital-forensics"
    ],
    "estimated_hours": {
     "value": 2,
     "is_estimate": true
    },
    "level": "expert"
   },
   {
    "id": "mod_graylog_security_tool_11",
    "slug": "graylog-security-tool-11",
    "title": "Lead and teach others",
    "outcome": "You can: set standards and teach others to use Graylog well",
    "topics": [
     "templates and conventions",
     "quality checks",
     "privacy and security settings",
     "onboarding a colleague or friend"
    ],
    "practice": "Write a one-page \"how we use Graylog\" guide and teach it to one person",
    "need_tags": [
     "workshop-facilitation",
     "security-operations",
     "digital-forensics"
    ],
    "estimated_hours": {
     "value": 2,
     "is_estimate": true
    },
    "level": "expert"
   }
  ]
 },
 "authoring": "archetype",
 "archetype": "security-tool",
 "expert_validation": {
  "status": "pending",
  "note": "Generated from the archetype template plus tool-specific signature skills; to be reviewed by a practitioner."
 },
 "is_illustrative": false
}