{
 "schema_version": "2.1",
 "id": "rm_ynab",
 "slug": "ynab",
 "title": "YNAB skill roadmap",
 "tool_ids": [
  "tool_ynab"
 ],
 "levels": {
  "beginner": [
   {
    "id": "mod_ynab_finance_payments_0",
    "slug": "ynab-finance-payments-0",
    "title": "Get started with YNAB",
    "outcome": "You can: set up YNAB, find your way around and finish a first small task",
    "topics": [
     "installation or account setup",
     "interface tour",
     "settings and accessibility options",
     "saving, exporting and sharing",
     "official help and documentation"
    ],
    "practice": "Complete the official getting-started guide, then one small real task from your work",
    "need_tags": [
     "personal-finance",
     "budgeting-fpa"
    ],
    "estimated_hours": {
     "value": 1,
     "is_estimate": true
    },
    "level": "beginner"
   },
   {
    "id": "mod_ynab_finance_payments_1",
    "slug": "ynab-finance-payments-1",
    "title": "Get paid",
    "outcome": "You can: send invoices or payment links",
    "topics": [
     "customers",
     "invoices/links",
     "payment methods",
     "receipts"
    ],
    "practice": "Send a test invoice or payment link",
    "need_tags": [
     "invoicing",
     "online-payments",
     "personal-finance",
     "budgeting-fpa"
    ],
    "estimated_hours": {
     "value": 1.0,
     "is_estimate": true
    },
    "level": "beginner"
   },
   {
    "id": "mod_ynab_finance_payments_2",
    "slug": "ynab-finance-payments-2",
    "title": "Keep records straight",
    "outcome": "You can: record income and expenses",
    "topics": [
     "categories",
     "attachments",
     "bank feeds"
    ],
    "practice": "Record a week of transactions",
    "need_tags": [
     "bookkeeping",
     "personal-finance",
     "budgeting-fpa"
    ],
    "estimated_hours": {
     "value": 1.0,
     "is_estimate": true
    },
    "level": "beginner"
   }
  ],
  "intermediate": [
   {
    "id": "mod_ynab_finance_payments_3",
    "slug": "ynab-finance-payments-3",
    "title": "Reconcile",
    "outcome": "You can: match records to the bank",
    "topics": [
     "reconciliation",
     "refunds",
     "fees",
     "disputes"
    ],
    "practice": "Reconcile a month",
    "need_tags": [
     "bookkeeping",
     "audit-analytics",
     "personal-finance",
     "budgeting-fpa"
    ],
    "estimated_hours": {
     "value": 2.0,
     "is_estimate": true
    },
    "level": "intermediate"
   },
   {
    "id": "mod_ynab_finance_payments_4",
    "slug": "ynab-finance-payments-4",
    "title": "Security and fraud",
    "outcome": "You can: protect money and accounts",
    "topics": [
     "two-step verification",
     "user roles",
     "scam awareness"
    ],
    "practice": "Review security settings and user roles",
    "need_tags": [
     "online-safety",
     "personal-finance",
     "budgeting-fpa"
    ],
    "estimated_hours": {
     "value": 1.0,
     "is_estimate": true
    },
    "level": "intermediate"
   },
   {
    "id": "mod_ynab_finance_payments_8",
    "slug": "ynab-finance-payments-8",
    "title": "Signature skills in YNAB",
    "outcome": "You can: use the features that make YNAB distinctive",
    "topics": [
     "giving every unit of money a job",
     "categories",
     "account syncing",
     "goals"
    ],
    "practice": "Use each of these features once on a real piece of work",
    "need_tags": [
     "personal-finance",
     "budgeting-fpa"
    ],
    "estimated_hours": {
     "value": 3,
     "is_estimate": true
    },
    "level": "intermediate"
   }
  ],
  "expert": [
   {
    "id": "mod_ynab_finance_payments_9",
    "slug": "ynab-finance-payments-9",
    "title": "Advanced YNAB",
    "outcome": "You can: use YNAB's advanced capabilities with confidence",
    "topics": [
     "reports",
     "reconciliation",
     "shared budgets"
    ],
    "practice": "Complete a project that needs at least two of these advanced capabilities",
    "need_tags": [
     "personal-finance",
     "budgeting-fpa"
    ],
    "estimated_hours": {
     "value": 4,
     "is_estimate": true
    },
    "level": "expert"
   },
   {
    "id": "mod_ynab_finance_payments_5",
    "slug": "ynab-finance-payments-5",
    "title": "Reporting and integration",
    "outcome": "You can: connect payments to accounting and reports",
    "topics": [
     "exports",
     "APIs/webhooks",
     "month-end reports"
    ],
    "practice": "Connect YNAB to your books or a sheet",
    "need_tags": [
     "bookkeeping",
     "automation-workflows",
     "personal-finance",
     "budgeting-fpa"
    ],
    "estimated_hours": {
     "value": 2.0,
     "is_estimate": true
    },
    "level": "expert"
   },
   {
    "id": "mod_ynab_finance_payments_10",
    "slug": "ynab-finance-payments-10",
    "title": "Integrate YNAB into your workflow",
    "outcome": "You can: connect YNAB with the other tools you use",
    "topics": [
     "imports and exports",
     "file formats",
     "integrations or APIs where available",
     "automation of repeated steps"
    ],
    "practice": "Connect YNAB to one other tool you use and remove one manual step",
    "need_tags": [
     "automation-workflows",
     "personal-finance",
     "budgeting-fpa"
    ],
    "estimated_hours": {
     "value": 2,
     "is_estimate": true
    },
    "level": "expert"
   },
   {
    "id": "mod_ynab_finance_payments_11",
    "slug": "ynab-finance-payments-11",
    "title": "Lead and teach others",
    "outcome": "You can: set standards and teach others to use YNAB well",
    "topics": [
     "templates and conventions",
     "quality checks",
     "privacy and security settings",
     "onboarding a colleague or friend"
    ],
    "practice": "Write a one-page \"how we use YNAB\" guide and teach it to one person",
    "need_tags": [
     "workshop-facilitation",
     "personal-finance",
     "budgeting-fpa"
    ],
    "estimated_hours": {
     "value": 2,
     "is_estimate": true
    },
    "level": "expert"
   }
  ]
 },
 "authoring": "archetype+signature",
 "archetype": "finance-payments",
 "expert_validation": {
  "status": "pending",
  "note": "Generated from the archetype template plus tool-specific signature skills; to be reviewed by a practitioner."
 },
 "is_illustrative": false
}